{
  "schema_version": "1.0.0",
  "manifest_version": "1.1.0",
  "execution_date": "2026-08-04",
  "schema_path": "tests/fixtures/test_cases_v1.schema.json",
  "schema_sha256": "559514670b1c1c2d8c9d53d655b0a4d36c095b687394bbcf7d0bbde58b8cf237",
  "generator_path": "tests/fixtures/generate_test_cases_v1.py",
  "generator_sha256": "084eda0722153223741f37a57d6bca07a0310abdad70198fb0ca9c5ef7bdd6ae",
  "fixture_sha256_kind": "sha256(canonical-json-without-fixture_sha256)",
  "recoverable_launch_errors": [
    "cudaErrorInvalidConfiguration",
    "cudaErrorLaunchOutOfResources"
  ],
  "fatal_faults": [
    {
      "id": "setup",
      "class": "fatal",
      "stage": "setup",
      "error": "cudaErrorInitializationError"
    },
    {
      "id": "allocator",
      "class": "fatal",
      "stage": "allocator",
      "error": "cudaErrorMemoryAllocation"
    },
    {
      "id": "h2d",
      "class": "fatal",
      "stage": "h2d",
      "error": "cudaErrorInvalidValue"
    },
    {
      "id": "event",
      "class": "fatal",
      "stage": "event",
      "error": "cudaErrorInvalidResourceHandle"
    },
    {
      "id": "launch",
      "class": "fatal",
      "stage": "launch",
      "error": "cudaErrorInvalidDeviceFunction"
    },
    {
      "id": "sync",
      "class": "fatal",
      "stage": "sync",
      "error": "cudaErrorUnknown"
    },
    {
      "id": "async",
      "class": "fatal",
      "stage": "async",
      "error": "cudaErrorUnknown"
    },
    {
      "id": "d2h",
      "class": "fatal",
      "stage": "d2h",
      "error": "cudaErrorECCUncorrectable"
    },
    {
      "id": "result_allocation",
      "class": "fatal",
      "stage": "result_allocation",
      "error": "MemoryError"
    },
    {
      "id": "context",
      "class": "fatal",
      "stage": "context",
      "error": "cudaErrorContextIsDestroyed"
    },
    {
      "id": "illegal_address",
      "class": "fatal",
      "stage": "illegal address",
      "error": "cudaErrorIllegalAddress"
    },
    {
      "id": "device_assert",
      "class": "fatal",
      "stage": "device assert",
      "error": "cudaErrorAssert"
    },
    {
      "id": "launch_failure",
      "class": "fatal",
      "stage": "launch failure",
      "error": "cudaErrorLaunchFailure"
    }
  ],
  "wildcard_templates": [
    {
      "template_id": "binary_frontier_leaf_count",
      "case_id_pattern": "binary_frontier_{leaf_count}",
      "target": "tests/fixtures/generate_corr_math_trace_v1.py",
      "axes": {
        "leaf_count": [
          0,
          1,
          2,
          3,
          4,
          5,
          6,
          7,
          8,
          9,
          10,
          11,
          12,
          13,
          14,
          15,
          16,
          17
        ]
      },
      "input": {
        "leaf_count": "{leaf_count}",
        "absolute_leaf_start": 0,
        "chunk_plan": [
          1,
          3,
          5,
          8
        ]
      },
      "injection": {
        "kind": "none",
        "continuous_absolute_leaf_order": true
      },
      "expect": {
        "fixed_tree_equal": true,
        "capacity_guard": true,
        "final_live_slots": "popcount(leaf_count)"
      }
    },
    {
      "template_id": "recoverable_launch_whitelist",
      "case_id_pattern": "recoverable_{error}",
      "target": "tests/fixtures/validate_test_cases_v1.py",
      "axes": {
        "error": [
          "cudaErrorInvalidConfiguration",
          "cudaErrorLaunchOutOfResources"
        ]
      },
      "input": {
        "operation": "parameter_scan",
        "group_index": 1
      },
      "injection": {
        "stage": "launch",
        "error": "{error}"
      },
      "expect": {
        "classification": "recoverable",
        "group_status": "failed",
        "scan_continues": true
      }
    },
    {
      "template_id": "fatal_fault_matrix",
      "case_id_pattern": "fatal_{fault}",
      "target": "tests/fixtures/validate_test_cases_v1.py",
      "axes": {
        "fault": [
          "setup",
          "allocator",
          "h2d",
          "event",
          "launch",
          "sync",
          "async",
          "d2h",
          "result_allocation",
          "context",
          "illegal_address",
          "device_assert",
          "launch_failure"
        ]
      },
      "input": {
        "operation": "parameter_scan",
        "group_index": 0
      },
      "injection": {
        "fault_id": "{fault}",
        "classification": "fatal"
      },
      "expect": {
        "raises": "RuntimeError",
        "no_partial_results": true,
        "raii_cleanup": true
      }
    },
    {
      "template_id": "rolling_mixed_dtype",
      "case_id_pattern": "rolling_{prediction_dtype}_{label_dtype}",
      "target": "benchmarks/compute_workspace_v1.py",
      "axes": {
        "prediction_dtype": [
          "float32",
          "float64"
        ],
        "label_dtype": [
          "float32",
          "float64"
        ]
      },
      "input": {
        "T": 1218,
        "N": 5000,
        "prediction_dtype": "{prediction_dtype}",
        "label_dtype": "{label_dtype}"
      },
      "injection": {
        "output_modes": [
          "cpu",
          "cuda_device"
        ],
        "accumulation": [
          "normal",
          "kahan"
        ]
      },
      "expect": {
        "levels_current": 20,
        "levels_next": 10,
        "cub_query_recorded": true,
        "timeline_complete": true
      }
    },
    {
      "template_id": "alias_path_matrix",
      "case_id_pattern": "alias_{operation}_{path}",
      "target": "tests/fixtures/corr_math_v1.py",
      "axes": {
        "operation": [
          "factor",
          "stock"
        ],
        "path": [
          "f32_conversion",
          "f64_alias",
          "f64_gather"
        ]
      },
      "input": {
        "operation": "{operation}",
        "dtype_path": "{path}"
      },
      "injection": {
        "layout_counterexamples": [
          "dtype",
          "strides",
          "alignment",
          "offset",
          "device",
          "owner",
          "lifetime"
        ]
      },
      "expect": {
        "selected_path": "{path}",
        "independent_predicate": true
      }
    },
    {
      "template_id": "output_contract",
      "case_id_pattern": "output_{output_mode}",
      "target": "benchmarks/compute_workspace_v1.py",
      "axes": {
        "output_mode": [
          "cpu",
          "cuda_device"
        ]
      },
      "input": {
        "backend": "cuda",
        "output_mode": "{output_mode}"
      },
      "injection": {
        "input_origin": "cpu_host"
      },
      "expect": {
        "cpu": {
          "container": "numpy.ndarray",
          "device_hwm": "tile_staging_only"
        },
        "cuda_device": {
          "container": "torch.Tensor",
          "dtype": "float64",
          "device": "mirror_input"
        }
      }
    },
    {
      "template_id": "artifact_validation",
      "case_id_pattern": "artifact_{fixture[id]}",
      "target": "{fixture[target]}",
      "axes": {
        "fixture": [
          {
            "id": "corr_corpus",
            "target": "tests/fixtures/validate_corr_corpus_v1.py"
          },
          {
            "id": "corr_math",
            "target": "tests/fixtures/generate_corr_math_trace_v1.py"
          },
          {
            "id": "workspace",
            "target": "benchmarks/compute_workspace_v1.py"
          },
          {
            "id": "calibration",
            "target": "tests/fixtures/generate_calibration_trace_v1.py"
          },
          {
            "id": "gate",
            "target": "benchmarks/generate_gate_config_v1.py"
          }
        ]
      },
      "input": {
        "artifact": "{fixture[id]}",
        "repo_relative_target": "{fixture[target]}"
      },
      "injection": {
        "kind": "none"
      },
      "expect": {
        "exit_code": 0,
        "deterministic_bytes": true
      }
    }
  ],
  "expanded_case_count": 50,
  "target_count": 7,
  "expanded_cases": [
    {
      "id": "binary_frontier_0",
      "template_id": "binary_frontier_leaf_count",
      "target": "tests/fixtures/generate_corr_math_trace_v1.py",
      "axes": {
        "leaf_count": 0
      },
      "input": {
        "leaf_count": 0,
        "absolute_leaf_start": 0,
        "chunk_plan": [
          1,
          3,
          5,
          8
        ]
      },
      "injection": {
        "kind": "none",
        "continuous_absolute_leaf_order": true
      },
      "expect": {
        "fixed_tree_equal": true,
        "capacity_guard": true,
        "final_live_slots": "popcount(leaf_count)"
      }
    },
    {
      "id": "binary_frontier_1",
      "template_id": "binary_frontier_leaf_count",
      "target": "tests/fixtures/generate_corr_math_trace_v1.py",
      "axes": {
        "leaf_count": 1
      },
      "input": {
        "leaf_count": 1,
        "absolute_leaf_start": 0,
        "chunk_plan": [
          1,
          3,
          5,
          8
        ]
      },
      "injection": {
        "kind": "none",
        "continuous_absolute_leaf_order": true
      },
      "expect": {
        "fixed_tree_equal": true,
        "capacity_guard": true,
        "final_live_slots": "popcount(leaf_count)"
      }
    },
    {
      "id": "binary_frontier_2",
      "template_id": "binary_frontier_leaf_count",
      "target": "tests/fixtures/generate_corr_math_trace_v1.py",
      "axes": {
        "leaf_count": 2
      },
      "input": {
        "leaf_count": 2,
        "absolute_leaf_start": 0,
        "chunk_plan": [
          1,
          3,
          5,
          8
        ]
      },
      "injection": {
        "kind": "none",
        "continuous_absolute_leaf_order": true
      },
      "expect": {
        "fixed_tree_equal": true,
        "capacity_guard": true,
        "final_live_slots": "popcount(leaf_count)"
      }
    },
    {